name,description
"Airpods Wireless Bluetooth Headphones","Bluetooth technology lets you connect it with compatible devices wirelessly High-quality AAC audio offers immersive listening experience Built-in microphone allows you to take calls while working"
"iPhone 11 Pro 256GB Memory","Introducing the iPhone 11 Pro. A transformative triple-camera system that adds tons of capability without complexity. An unprecedented leap in battery life"
"Cannon EOS 80D DSLR Camera","Characterized by versatile imaging specs, the Canon EOS 80D further clarifies itself using a pair of robust focusing systems and an intuitive design"
"Sony Playstation 4 Pro White Version","The ultimate home entertainment center starts with PlayStation. Whether you are into gaming, HD movies, television, music"
"Logitech G-Series Gaming Mouse","Get a better handle on your games with this Logitech LIGHTSYNC gaming mouse. The six programmable buttons allow customization for a smooth playing experience"
"Amazon Echo Dot 3rd Generation","Meet Echo Dot - Our most popular smart speaker with a fabric design. It is our most compact smart speaker that fits perfectly into small space"
    